{
  "schemaVersion": "0.5.0",
  "arenaModelId": "grougalorasalar-arena-draft-0.5.0",
  "status": "draft_single_reference",
  "sourceReferences": [
    {
      "id": "user_reference",
      "path": "assets/reference/user_reference.png",
      "width": 1951,
      "height": 1267,
      "sha256": "2756a38a4451117001dedeab2e4da14423d4aa50978bc4549c9ff0cb1340f976",
      "authority": "user_supplied_current_style_screenshot"
    }
  ],
  "coordinateSystem": {
    "type": "logical_square_grid_isometric_render",
    "originCell": {
      "x": 0,
      "y": 0
    },
    "originPixel": {
      "x": 964.895,
      "y": 441.7425
    },
    "xAxis": {
      "screenDirection": "down_right",
      "basisPixel": {
        "x": 66.75,
        "y": 33.375
      }
    },
    "yAxis": {
      "screenDirection": "down_left",
      "basisPixel": {
        "x": -66.75,
        "y": 33.375
      }
    },
    "projectionFormula": "pixel = originPixel + x*xAxis.basisPixel + y*yAxis.basisPixel",
    "inverseUse": "editor_and_calibration_only"
  },
  "projectionAnchorCell": {
    "x": 0,
    "y": 0
  },
  "projectionAnchorStatus": "draft_from_map_centre_and_guide_alignment",
  "cellSets": {
    "walkableConfirmed": [
      {
        "x": 1,
        "y": -10
      },
      {
        "x": 0,
        "y": -9
      },
      {
        "x": 1,
        "y": -9
      },
      {
        "x": -1,
        "y": -8
      },
      {
        "x": 1,
        "y": -8
      },
      {
        "x": 2,
        "y": -8
      },
      {
        "x": 3,
        "y": -8
      },
      {
        "x": -2,
        "y": -7
      },
      {
        "x": -1,
        "y": -7
      },
      {
        "x": 0,
        "y": -7
      },
      {
        "x": 1,
        "y": -7
      },
      {
        "x": 2,
        "y": -7
      },
      {
        "x": 3,
        "y": -7
      },
      {
        "x": 4,
        "y": -7
      },
      {
        "x": -3,
        "y": -6
      },
      {
        "x": -2,
        "y": -6
      },
      {
        "x": -1,
        "y": -6
      },
      {
        "x": 0,
        "y": -6
      },
      {
        "x": 1,
        "y": -6
      },
      {
        "x": 2,
        "y": -6
      },
      {
        "x": 3,
        "y": -6
      },
      {
        "x": 4,
        "y": -6
      },
      {
        "x": 5,
        "y": -6
      },
      {
        "x": -3,
        "y": -5
      },
      {
        "x": -2,
        "y": -5
      },
      {
        "x": 0,
        "y": -5
      },
      {
        "x": 1,
        "y": -5
      },
      {
        "x": 3,
        "y": -5
      },
      {
        "x": 5,
        "y": -5
      },
      {
        "x": 6,
        "y": -5
      },
      {
        "x": -5,
        "y": -4
      },
      {
        "x": -4,
        "y": -4
      },
      {
        "x": -3,
        "y": -4
      },
      {
        "x": -2,
        "y": -4
      },
      {
        "x": -1,
        "y": -4
      },
      {
        "x": 0,
        "y": -4
      },
      {
        "x": 1,
        "y": -4
      },
      {
        "x": 2,
        "y": -4
      },
      {
        "x": 3,
        "y": -4
      },
      {
        "x": 4,
        "y": -4
      },
      {
        "x": 5,
        "y": -4
      },
      {
        "x": 6,
        "y": -4
      },
      {
        "x": 7,
        "y": -4
      },
      {
        "x": -6,
        "y": -3
      },
      {
        "x": -5,
        "y": -3
      },
      {
        "x": -4,
        "y": -3
      },
      {
        "x": -3,
        "y": -3
      },
      {
        "x": -2,
        "y": -3
      },
      {
        "x": -1,
        "y": -3
      },
      {
        "x": 1,
        "y": -3
      },
      {
        "x": 2,
        "y": -3
      },
      {
        "x": 3,
        "y": -3
      },
      {
        "x": 4,
        "y": -3
      },
      {
        "x": 5,
        "y": -3
      },
      {
        "x": 6,
        "y": -3
      },
      {
        "x": 7,
        "y": -3
      },
      {
        "x": 8,
        "y": -3
      },
      {
        "x": -7,
        "y": -2
      },
      {
        "x": -5,
        "y": -2
      },
      {
        "x": -3,
        "y": -2
      },
      {
        "x": -2,
        "y": -2
      },
      {
        "x": -1,
        "y": -2
      },
      {
        "x": 0,
        "y": -2
      },
      {
        "x": 1,
        "y": -2
      },
      {
        "x": 3,
        "y": -2
      },
      {
        "x": 4,
        "y": -2
      },
      {
        "x": 6,
        "y": -2
      },
      {
        "x": 7,
        "y": -2
      },
      {
        "x": 8,
        "y": -2
      },
      {
        "x": 9,
        "y": -2
      },
      {
        "x": -8,
        "y": -1
      },
      {
        "x": -7,
        "y": -1
      },
      {
        "x": -6,
        "y": -1
      },
      {
        "x": -5,
        "y": -1
      },
      {
        "x": -4,
        "y": -1
      },
      {
        "x": -3,
        "y": -1
      },
      {
        "x": -2,
        "y": -1
      },
      {
        "x": 0,
        "y": -1
      },
      {
        "x": 3,
        "y": -1
      },
      {
        "x": 4,
        "y": -1
      },
      {
        "x": 5,
        "y": -1
      },
      {
        "x": 6,
        "y": -1
      },
      {
        "x": 8,
        "y": -1
      },
      {
        "x": 9,
        "y": -1
      },
      {
        "x": 10,
        "y": -1
      },
      {
        "x": -9,
        "y": 0
      },
      {
        "x": -8,
        "y": 0
      },
      {
        "x": -7,
        "y": 0
      },
      {
        "x": -6,
        "y": 0
      },
      {
        "x": -5,
        "y": 0
      },
      {
        "x": -4,
        "y": 0
      },
      {
        "x": -3,
        "y": 0
      },
      {
        "x": -2,
        "y": 0
      },
      {
        "x": -1,
        "y": 0
      },
      {
        "x": 0,
        "y": 0
      },
      {
        "x": 1,
        "y": 0
      },
      {
        "x": 2,
        "y": 0
      },
      {
        "x": 3,
        "y": 0
      },
      {
        "x": 4,
        "y": 0
      },
      {
        "x": 5,
        "y": 0
      },
      {
        "x": 7,
        "y": 0
      },
      {
        "x": 8,
        "y": 0
      },
      {
        "x": 9,
        "y": 0
      },
      {
        "x": -10,
        "y": 1
      },
      {
        "x": -9,
        "y": 1
      },
      {
        "x": -8,
        "y": 1
      },
      {
        "x": -6,
        "y": 1
      },
      {
        "x": -5,
        "y": 1
      },
      {
        "x": -4,
        "y": 1
      },
      {
        "x": -2,
        "y": 1
      },
      {
        "x": 3,
        "y": 1
      },
      {
        "x": 4,
        "y": 1
      },
      {
        "x": 5,
        "y": 1
      },
      {
        "x": 6,
        "y": 1
      },
      {
        "x": 7,
        "y": 1
      },
      {
        "x": 8,
        "y": 1
      },
      {
        "x": 9,
        "y": 1
      },
      {
        "x": -9,
        "y": 2
      },
      {
        "x": -8,
        "y": 2
      },
      {
        "x": -7,
        "y": 2
      },
      {
        "x": -6,
        "y": 2
      },
      {
        "x": -5,
        "y": 2
      },
      {
        "x": -4,
        "y": 2
      },
      {
        "x": -3,
        "y": 2
      },
      {
        "x": -2,
        "y": 2
      },
      {
        "x": -1,
        "y": 2
      },
      {
        "x": 1,
        "y": 2
      },
      {
        "x": 2,
        "y": 2
      },
      {
        "x": 3,
        "y": 2
      },
      {
        "x": 4,
        "y": 2
      },
      {
        "x": 5,
        "y": 2
      },
      {
        "x": 6,
        "y": 2
      },
      {
        "x": 7,
        "y": 2
      },
      {
        "x": -8,
        "y": 3
      },
      {
        "x": -7,
        "y": 3
      },
      {
        "x": -6,
        "y": 3
      },
      {
        "x": -5,
        "y": 3
      },
      {
        "x": -4,
        "y": 3
      },
      {
        "x": -3,
        "y": 3
      },
      {
        "x": -2,
        "y": 3
      },
      {
        "x": -1,
        "y": 3
      },
      {
        "x": 0,
        "y": 3
      },
      {
        "x": 1,
        "y": 3
      },
      {
        "x": 2,
        "y": 3
      },
      {
        "x": 3,
        "y": 3
      },
      {
        "x": 4,
        "y": 3
      },
      {
        "x": 5,
        "y": 3
      },
      {
        "x": -7,
        "y": 4
      },
      {
        "x": -5,
        "y": 4
      },
      {
        "x": -4,
        "y": 4
      },
      {
        "x": -3,
        "y": 4
      },
      {
        "x": -2,
        "y": 4
      },
      {
        "x": -1,
        "y": 4
      },
      {
        "x": 1,
        "y": 4
      },
      {
        "x": 2,
        "y": 4
      },
      {
        "x": 4,
        "y": 4
      },
      {
        "x": 5,
        "y": 4
      },
      {
        "x": -6,
        "y": 5
      },
      {
        "x": -5,
        "y": 5
      },
      {
        "x": -4,
        "y": 5
      },
      {
        "x": -3,
        "y": 5
      },
      {
        "x": -2,
        "y": 5
      },
      {
        "x": -1,
        "y": 5
      },
      {
        "x": 0,
        "y": 5
      },
      {
        "x": 1,
        "y": 5
      },
      {
        "x": 2,
        "y": 5
      },
      {
        "x": 3,
        "y": 5
      },
      {
        "x": 4,
        "y": 5
      },
      {
        "x": -5,
        "y": 6
      },
      {
        "x": -4,
        "y": 6
      },
      {
        "x": -2,
        "y": 6
      },
      {
        "x": -1,
        "y": 6
      },
      {
        "x": 0,
        "y": 6
      },
      {
        "x": 1,
        "y": 6
      },
      {
        "x": 2,
        "y": 6
      },
      {
        "x": 3,
        "y": 6
      },
      {
        "x": -4,
        "y": 7
      },
      {
        "x": -3,
        "y": 7
      },
      {
        "x": -2,
        "y": 7
      },
      {
        "x": 0,